{
  "schema": 1,
  "source": "adrs/ACTIVE.md",
  "active_sha256": "a66f3fcc15e61830e49506da9b541665f6945e1a2e6c200a753a9d44874f2079",
  "adrs": [
    {
      "adr": "0001",
      "lineage": "L-0001",
      "origin": "charter",
      "effective": "2026-01-01"
    },
    {
      "adr": "0002",
      "lineage": "L-0002",
      "origin": "charter",
      "effective": "2026-01-01"
    },
    {
      "adr": "0003",
      "lineage": "L-0003",
      "origin": "charter",
      "effective": "2026-01-01"
    },
    {
      "adr": "0004",
      "lineage": "L-0004",
      "origin": "charter",
      "effective": "2026-01-01"
    },
    {
      "adr": "0005",
      "lineage": "L-0005",
      "origin": "charter",
      "effective": "2026-01-01"
    },
    {
      "adr": "0006",
      "lineage": "L-0006",
      "origin": "charter",
      "effective": "2026-01-01"
    },
    {
      "adr": "0007",
      "lineage": "L-0007",
      "origin": "charter",
      "effective": "2026-01-01"
    },
    {
      "adr": "0008",
      "lineage": "L-0008",
      "origin": "charter",
      "effective": "2026-01-01"
    },
    {
      "adr": "0009",
      "lineage": "L-0009",
      "origin": "charter",
      "effective": "2026-01-01"
    },
    {
      "adr": "0010",
      "lineage": "L-0010",
      "origin": "charter",
      "effective": "2026-01-01"
    },
    {
      "adr": "0011",
      "lineage": "L-0011",
      "origin": "charter",
      "effective": "2026-01-01"
    },
    {
      "adr": "0012",
      "lineage": "L-0012",
      "origin": "charter",
      "effective": "2026-01-01"
    },
    {
      "adr": "0013",
      "lineage": "L-0013",
      "origin": "charter",
      "effective": "2026-01-01"
    },
    {
      "adr": "0014",
      "lineage": "L-0014",
      "origin": "charter",
      "effective": "2026-01-01"
    },
    {
      "adr": "0015",
      "lineage": "L-0015",
      "origin": "charter",
      "effective": "2026-01-01"
    },
    {
      "adr": "0016",
      "lineage": "L-0016",
      "origin": "charter",
      "effective": "2026-01-01"
    },
    {
      "adr": "0017",
      "lineage": "L-0017",
      "origin": "charter",
      "effective": "2026-01-01"
    },
    {
      "adr": "0018",
      "lineage": "L-0018",
      "origin": "charter",
      "effective": "2026-01-01"
    },
    {
      "adr": "0019",
      "lineage": "L-0019",
      "origin": "charter",
      "effective": "2026-01-01"
    },
    {
      "adr": "0020",
      "lineage": "L-0020",
      "origin": "charter",
      "effective": "2026-01-01"
    },
    {
      "adr": "0021",
      "lineage": "L-0021",
      "origin": "charter",
      "effective": "2026-01-01"
    },
    {
      "adr": "0022",
      "lineage": "L-0022",
      "origin": "charter",
      "effective": "2026-01-01"
    },
    {
      "adr": "0023",
      "lineage": "L-0023",
      "origin": "charter",
      "effective": "2026-01-01"
    },
    {
      "adr": "0024",
      "lineage": "L-0024",
      "origin": "session",
      "effective": "2026-09-22"
    },
    {
      "adr": "0025",
      "lineage": "L-0025",
      "origin": "session",
      "effective": "2026-09-22"
    },
    {
      "adr": "0026",
      "lineage": "L-0026",
      "origin": "session",
      "effective": "2026-09-22"
    },
    {
      "adr": "0027",
      "lineage": "L-0027",
      "origin": "session",
      "effective": "2026-09-22"
    },
    {
      "adr": "0028",
      "lineage": "L-0028",
      "origin": "session",
      "effective": "2026-09-22"
    },
    {
      "adr": "0029",
      "lineage": "L-0029",
      "origin": "session",
      "effective": "2026-09-22"
    },
    {
      "adr": "0030",
      "lineage": "L-0030",
      "origin": "session",
      "effective": "2026-09-22"
    },
    {
      "adr": "0031",
      "lineage": "L-0031",
      "origin": "session",
      "effective": "2026-09-23"
    },
    {
      "adr": "0032",
      "lineage": "L-0032",
      "origin": "session",
      "effective": "2026-09-23"
    },
    {
      "adr": "0033",
      "lineage": "L-0033",
      "origin": "session",
      "effective": "2026-09-23"
    },
    {
      "adr": "0034",
      "lineage": "L-0034",
      "origin": "session",
      "effective": "2026-09-23"
    },
    {
      "adr": "0035",
      "lineage": "L-0035",
      "origin": "session",
      "effective": "2026-09-23"
    },
    {
      "adr": "0036",
      "lineage": "L-0036",
      "origin": "session",
      "effective": "2026-09-23"
    },
    {
      "adr": "0037",
      "lineage": "L-0037",
      "origin": "session",
      "effective": "2026-09-23"
    },
    {
      "adr": "0038",
      "lineage": "L-0038",
      "origin": "session",
      "effective": "2026-09-23"
    },
    {
      "adr": "0039",
      "lineage": "L-0039",
      "origin": "session",
      "effective": "2026-09-23"
    },
    {
      "adr": "0040",
      "lineage": "L-0040",
      "origin": "session",
      "effective": "2026-09-23"
    },
    {
      "adr": "0041",
      "lineage": "L-0041",
      "origin": "session",
      "effective": "2026-09-23"
    },
    {
      "adr": "0042",
      "lineage": "L-0042",
      "origin": "session",
      "effective": "2026-09-23"
    },
    {
      "adr": "0043",
      "lineage": "L-0043",
      "origin": "session",
      "effective": "2026-09-23"
    },
    {
      "adr": "0044",
      "lineage": "L-0044",
      "origin": "session",
      "effective": "2026-09-25"
    },
    {
      "adr": "0045",
      "lineage": "L-0045",
      "origin": "session",
      "effective": "2026-09-26"
    },
    {
      "adr": "0050",
      "lineage": "L-0050",
      "origin": "RCA 2026-10-10 SHA-pinned evidence / content identity",
      "effective": "2026-10-10"
    },
    {
      "adr": "0054",
      "lineage": "L-0054",
      "origin": "RCA 2026-10-20 published-skill author contract",
      "effective": "2026-10-24"
    },
    {
      "adr": "0055",
      "lineage": "L-0055",
      "origin": "RCA 2026-10-25 staged activation of gate machinery",
      "effective": "2026-10-25"
    }
  ],
  "written_at": "2026-10-25T03:32:44Z"
}
